{
  "schema_name": "scientific-evidence.artifact-manifest",
  "artifact": {
    "path": "data/raw/market_news_live.json",
    "kind": "news_and_horizon_output",
    "sha256": "7af55b5c13f946d3eec0598f7c7a3b1b18f6a54ab50f3da20eac2cb9d47888a2"
  },
  "derived_from": [
    "https://iss.moex.com/iss/sitenews.json?iss.meta=off",
    "https://www.cbr.ru/rss/eventrss",
    "https://www.cbr.ru/rss/RssPress",
    "https://news.google.com/rss/search?q=%D0%A6%D0%91%20%D0%A0%D0%A4%20%D0%BA%D0%BB%D1%8E%D1%87%D0%B5%D0%B2%D0%B0%D1%8F%20%D1%81%D1%82%D0%B0%D0%B2%D0%BA%D0%B0%20%D0%B8%D0%BD%D1%84%D0%BB%D1%8F%D1%86%D0%B8%D1%8F%20%D0%9C%D0%BE%D1%81%D0%B1%D0%B8%D1%80%D0%B6%D0%B0%202026&hl=ru&gl=RU&ceid=RU:ru",
    "https://news.google.com/rss/search?q=%28%D0%9B%D1%83%D0%BA%D0%BE%D0%B9%D0%BB%20OR%20%D0%A0%D0%BE%D1%81%D0%BD%D0%B5%D1%84%D1%82%D1%8C%20OR%20%D0%A2%D0%B0%D1%82%D0%BD%D0%B5%D1%84%D1%82%D1%8C%20OR%20%D0%A1%D1%83%D1%80%D0%B3%D1%83%D1%82%D0%BD%D0%B5%D1%84%D1%82%D0%B5%D0%B3%D0%B0%D0%B7%20OR%20%D0%A2%D1%80%D0%B0%D0%BD%D1%81%D0%BD%D0%B5%D1%84%D1%82%D1%8C%20OR%20%D0%93%D0%B0%D0%B7%D0%BF%D1%80%D0%BE%D0%BC%20OR%20%D0%9D%D0%9E%D0%92%D0%90%D0%A2%D0%AD%D0%9A%29%20%D0%B0%D0%BA%D1%86%D0%B8%D0%B8%20%D0%B4%D0%B8%D0%B2%D0%B8%D0%B4%D0%B5%D0%BD%D0%B4%D1%8B&hl=ru&gl=RU&ceid=RU:ru",
    "https://news.google.com/rss/search?q=%28%D0%A1%D0%B1%D0%B5%D1%80%D0%B1%D0%B0%D0%BD%D0%BA%20OR%20%22%D0%91%D0%B0%D0%BD%D0%BA%20%D0%A1%D0%B0%D0%BD%D0%BA%D1%82-%D0%9F%D0%B5%D1%82%D0%B5%D1%80%D0%B1%D1%83%D1%80%D0%B3%22%20OR%20%22%D0%A2-%D0%A2%D0%B5%D1%85%D0%BD%D0%BE%D0%BB%D0%BE%D0%B3%D0%B8%D0%B8%22%20OR%20%D0%A1%D0%BE%D0%B2%D0%BA%D0%BE%D0%BC%D0%B1%D0%B0%D0%BD%D0%BA%20OR%20%D0%92%D0%A2%D0%91%20OR%20%D0%9C%D0%BE%D1%81%D0%B1%D0%B8%D1%80%D0%B6%D0%B0%20OR%20%22%D0%A1%D0%9F%D0%91%20%D0%91%D0%B8%D1%80%D0%B6%D0%B0%22%29%20%D0%B0%D0%BA%D1%86%D0%B8%D0%B8&hl=ru&gl=RU&ceid=RU:ru"
  ],
  "generated_by": {
    "script_path": "scripts/news_and_horizon_engine.py",
    "timestamp_utc": "2026-10-19T16:30:33.570092+00:00"
  }
}